{
  "behaviorConformance": {
    "applicable": true,
    "policyID": "short-interaction-response-v1",
    "reasonCodes": [
      "behavior_not_verified"
    ],
    "status": "not_verified"
  },
  "benchmarkRelease": {
    "id": "suite-b-power",
    "protocolVersion": "1.1.0-rc.1"
  },
  "metricEligibility": {
    "decode_tokens_per_second@1": {
      "eligible": true,
      "eligibleMeasuredAttempts": 5,
      "reasonCodes": []
    },
    "first_renderable_proxy_ttft_ms@1": {
      "eligible": true,
      "eligibleMeasuredAttempts": 5,
      "reasonCodes": []
    },
    "pipeline_ttft_ms@1": {
      "eligible": true,
      "eligibleMeasuredAttempts": 5,
      "reasonCodes": []
    },
    "prefill_tokens_per_second@1": {
      "eligible": true,
      "eligibleMeasuredAttempts": 5,
      "reasonCodes": []
    },
    "process_physical_footprint_mib@1": {
      "eligible": true,
      "eligibleMeasuredAttempts": 5,
      "reasonCodes": []
    },
    "request_completion_ms@1": {
      "eligible": true,
      "eligibleMeasuredAttempts": 5,
      "reasonCodes": []
    }
  },
  "performanceRankingEligibility": {
    "eligible": true,
    "reasonCodes": []
  },
  "protocolConformance": {
    "reasonCodes": [],
    "valid": true
  },
  "rankingPolicy": {
    "id": "suite-b-power-ranking-policy",
    "version": "1.1.0"
  },
  "recommendationEligibility": {
    "eligible": false,
    "reasonCodes": [
      "behavior_verification_required"
    ]
  },
  "result": {
    "id": "21B5F28F-DA9C-4381-87BA-DBFFEB1D8A84",
    "schemaVersion": "suite-b-power-result-1.1.0-rc.1",
    "sha256": "bcc40c1b4dd06143c9877b049c748520d7a61c579d4699902a7b60d0d1e1153b"
  },
  "schemaVersion": "suite-b-power-validation-report-1.1.0",
  "structuralValidity": {
    "reasonCodes": [],
    "valid": true
  },
  "validator": {
    "id": "suite-b-power-validator",
    "version": "1.1.0"
  }
}
